target,text
ham,Ok... I din get ur msg...
ham,Ok leave no need to ask
ham,We are both fine. Thanks
ham,Somebody set up a website where you can play hold em using eve online spacebucks
ham,"No dice, art class 6 thru 9 :( thanks though. Any idea what time I should come tomorrow?"
ham,Did you stitch his trouser
ham,Where's my boytoy? I miss you ... What happened?
ham,"Sorry, I'll call later"
spam,"Welcome to Select, an O2 service with added benefits. You can now call our specially trained advisors FREE from your mobile by dialling 402."
ham,"My mobile number.pls sms ur mail id.convey regards to achan,amma.Rakhesh.Qatar"
ham,The length is e same but e top shorter n i got a fringe now. I thk i'm not going liao. Too lazy. Dun wan 2 distract u also.
spam,Dorothy@kiefer.com (Bank of Granite issues Strong-Buy) EXPLOSIVE PICK FOR OUR MEMBERS *****UP OVER 300% *********** Nasdaq Symbol CDGT That is a $5.00 per..
ham,Haven't eaten all day. I'm sitting here staring at this juicy pizza and I can't eat it. These meds are ruining my life.
ham,He says hi and to get your ass back to south tampa (preferably at a kegger)
ham,No prob. I will send to your email.
ham,And whenever you and i see we can still hook up too.
ham,Tmr timin still da same wat cos i got lesson until 6...
ham,"I hope your alright babe? I worry that you might have felt a bit desparate when you learned the job was a fake ? I am here waiting when you come back, my love"
spam,U have won a nokia 6230 plus a free digital camera. This is what u get when u win our FREE auction. To take part send NOKIA to 83383 now. POBOX114/14TCR/W1 16
ham,Nothing just getting msgs by dis name wit different no's..
ham,Dear i am not denying your words please
ham,"Hey chief, can you give me a bell when you get this. Need to talk to you about this royal visit on the 1st june. "
ham,"There'll be a minor shindig at my place later tonight, you interested?"
ham,What you did in  leave.
ham,have got * few things to do. may be in * pub later.
ham,Pls accept me for one day. Or am begging you change the number.
spam,18 days to Euro2004 kickoff! U will be kept informed of all the latest news and results daily. Unsubscribe send GET EURO STOP to 83222.
ham,Carlos is taking his sweet time as usual so let me know when you and patty are done/want to smoke and I'll tell him to haul ass
ham,You will be in the place of that man
ham,Are you going to wipro interview today?
ham,"Kind of. Just missed train cos of asthma attack, nxt one in half hr so driving in. not sure where to park."
ham,"Cool, what time you think you can get here?"
ham,Mum ask Ì_ to buy food home...
ham,"Good evening Sir, Al Salam Wahleykkum.sharing a happy news.By the grace of God, i got an offer from Tayseer,TISSCO and i joined.Hope you are fine.Inshah Allah,meet you sometime.Rakhesh,visitor from India."
ham,i felt so...not any conveying reason.. Ese he... What about me?
ham,"Rose for red,red for blood,blood for heart,heart for u. But u for me.... Send tis to all ur friends.. Including me.. If u like me.. If u get back, 1-u r poor in relation! 2-u need some 1 to support 3-u r frnd 2 many 4-some1 luvs u 5+- some1 is praying god to marry u.:-) try it...."
ham,Dear where you. Call me
ham,I don wake since. I checked that stuff and saw that its true no available spaces. Pls call the embassy or send a mail to them.
ham,The basket's gettin full so I might be by tonight
ham,Hey i booked the kb on sat already... what other lessons are we going for ah? Keep your sat night free we need to meet and confirm our lodging 
ham,What should i eat fo lunch senor
ham,And smile for me right now as you go and the world will wonder what you are smiling about and think your crazy and keep away from you ... *grins*
spam,"U can WIN å£100 of Music Gift Vouchers every week starting NOW Txt the word DRAW to 87066 TsCs www.Idew.com SkillGame, 1Winaweek, age16. 150ppermessSubscription"
ham,S:)8 min to go for lunch:)
ham,"I wasn't well babe, i have swollen glands at my throat ... What did you end up doing ?"
ham,"Sorry, I'll call later"
ham,I am waiting for your call sir.
ham,Oh great. I.ll disturb him more so that we can talk.
ham,I wont. So wat's wit the guys
ham,Does daddy have a bb now.
ham,A little. Meds say take once every 8 hours. It's only been 5 but pain is back. So I took another. Hope I don't die
ham,Oh ok.. Wat's ur email?
ham,"Gal n boy walking in d park. gal-can i hold ur hand? boy-y? do u think i would run away? gal-no, jst wana c how it feels walking in heaven with an prince..GN:-)"
ham,"yeah, that's what I was thinking"
ham,Nah im goin 2 the wrks with j wot bout u?
ham,Wat so late still early mah. Or we juz go 4 dinner lor. Aiya i dunno...
ham,I wish things were different. I wonder when i will be able to show you how much i value you. Pls continue the brisk walks no drugs without askin me please and find things to laugh about. I love you dearly.
spam,FREE for 1st week! No1 Nokia tone 4 ur mob every week just txt NOKIA to 8007 Get txting and tell ur mates www.getzed.co.uk POBox 36504 W45WQ norm150p/tone 16+
ham,Feel Yourself That You Are Always Happy.. Slowly It Becomes Your Habit &amp; Finally It Becomes Part Of Your Life.. Follow It.. Happy Morning &amp; Have A Happy Day:)
ham,"It's that time of the week again, ryan"
ham,Oh just getting even with u.... u?
ham,Just got to  &lt;#&gt;
ham,Ooooooh I forgot to tell u I can get on yoville on my phone
ham,Hiya. How was last night? I've been naughty and bought myself clothes and very little ... Ready for more shopping tho! What kind of time do you wanna meet?
ham,Cool. So how come you havent been wined and dined before?
ham,ÌÏ dun need to pick ur gf?
ham,Okay lor... Will they still let us go a not ah? Coz they will not know until later. We drop our cards into the box right?
ham,Just come home. I don't want u to be miserable
ham,"I sent my scores to sophas and i had to do secondary application for a few schools. I think if you are thinking of applying, do a research on cost also. Contact joke ogunrinde, her school is one me the less expensive ones"
spam,http//tms. widelive.com/index. wml?id=820554ad0a1705572711&first=trueåÁC C RingtoneåÁ
ham,Hi here. have birth at on the  to  at 8lb 7oz. Mother and baby doing brilliantly.
ham,Both :) i shoot big loads so get ready!
ham,Sorry . I will be able to get to you. See you in the morning.
ham,"alright, I'll make sure the car is back tonight"
ham,"Haha figures, well I found the piece and priscilla's bowl"
ham,S but not able to sleep.
ham,Nope i'm not drivin... I neva develop da photos lei...
ham,I am waiting machan. Call me once you free.
ham,Good morning princess! How are you?
ham,Now project pa. After that only i can come.
ham,Sounds better than my evening im just doing my costume. Im not sure what time i finish tomorrow but i will txt you at the end.
ham,Your bill at 3 is å£33.65 so thats not bad!
ham,Yes we were outside for like 2 hours. And I called my whole family to wake them up cause it started at 1 am
ham,Are you driving or training?
ham,I'm in chennai velachery:)
ham,Anyway i'm going shopping on my own now. Cos my sis not done yet. Dun disturb u liao.
ham,How are you babes. Hope your doing ok. I had a shit nights sleep. I fell asleep at 5.IåÕm knackered and iåÕm dreading work tonight. What are thou upto tonight. X
ham,"Aight will do, thanks again for comin out"
ham,Lol your right. What diet? Everyday I cheat anyway. I'm meant to be a fatty :(
ham,But you were together so you should be thinkin about him
ham,Short But Cute: \Be a good person
ham,:( but your not here....
ham,"Ok thats cool. Its , just off either raglan rd or edward rd. Behind the cricket ground. Gimme ring when ur closeby see you tuesday."
ham,"That's very rude, you on campus?"
ham,Oh...i asked for fun. Haha...take care. Ì_
ham,2 and half years i missed your friendship:-)
ham,"Well the general price is  &lt;#&gt; /oz, let me know if/when/how much you want"
ham,Ok lor.
ham,"Sorry da thangam, very very sorry i am held up with prasad."
ham,Ok no prob...
ham,Ha... U jus ate honey ar? So sweet...
ham,"Sorry, I'll call later"
ham,SERIOUSLY. TELL HER THOSE EXACT WORDS RIGHT NOW.
ham,Remember on that day..
ham,"Babe, have you got enough money to pick up bread and milk ? And I'll give you it back when you get home ?"
ham,Have a nice day my dear.
ham,Got meh... When?
ham,"K so am I, how much for an 8th? Fifty?"
ham,Sos! Any amount i can get pls.
ham,&lt;#&gt;  w jetton ave if you forgot
ham,"Sorry, I'll call later"
ham,I'll probably be around mu a lot
ham,Re your call; You didn't see my facebook huh?
ham,IÛ÷m going to try for 2 months ha ha only joking
ham,I think u have the wrong number.
ham,Ok...
ham,Raji..pls do me a favour. Pls convey my Birthday wishes to Nimya. Pls. Today is her birthday.
ham,"Yo my trip got postponed, you still stocked up?"
spam,"Download as many ringtones as u like no restrictions, 1000s 2 choose. U can even send 2 yr buddys. Txt Sir to 80082 å£3 "
ham,Was playng 9 doors game and gt racing on phone lol
ham,Whom you waited for yesterday
ham,* Was thinking about chuckin ur red green n black trainners 2 save carryin them bac on train
ham,Shall call now dear having food
ham,"A bit of Ur smile is my hppnss, a drop of Ur tear is my sorrow, a part of Ur heart is my life, a heart like mine wil care for U, forevr as my GOODFRIEND"
ham,In work now. Going have in few min.
ham,I've sent my wife your text. After we buy them she'll tell you what to do. So just relax. We should go get them this wkend.
spam,XMAS iscoming & ur awarded either å£500 CD gift vouchers & free entry 2 r å£100 weekly draw txt MUSIC to 87066 TnC www.Ldew.com1win150ppmx3age16subscription 
ham,When did i use soc... I use it only at home... ÌÏ dunno how 2 type it in word ar...
spam,"Free Msg: get Gnarls Barkleys \Crazy\"" ringtone TOTALLY FREE just reply GO to this message right now!"""
spam,Welcome! Please reply with your AGE and GENDER to begin. e.g 24M
ham,"Hey, iouri gave me your number, I'm wylie, ryan's friend"
ham,Pls speak to that customer machan.
ham,You should get more chicken broth if you want ramen unless there's some I don't know about
ham,"My Parents, My Kidz, My Friends n My Colleagues. All screaming.. SURPRISE !! and I was waiting on the sofa.. ... ..... ' NAKED...!"
ham,No calls..messages..missed calls
ham,Bull. Your plan was to go floating off to IKEA with me without a care in the world. So i have to live with your mess another day.
ham,"Ha ha nan yalrigu heltini..Iyo kothi chikku, u shared many things wit me..so far i didn't told any body and even uttered a word abt u.. If ur trusting me so much how can i tell these to others.. Plz nxt time dont use those words to me..ok, chikku:-);-)B-)"
ham,"Aight yo, dats straight dogg"
ham,Hey check it da. I have listed da.
ham,Does she usually take fifteen fucking minutes to respond to a yes or no question
ham,Yar lor wait 4 my mum 2 finish sch then have lunch lor... I whole morning stay at home clean my room now my room quite clean... Hee...
ham,"Aight I've been set free, think you could text me blake's address? It occurs to me I'm not quite as sure what I'm doing as I thought I was"
spam,"WIN: We have a winner! Mr. T. Foley won an iPod! More exciting prizes soon, so keep an eye on ur mobile or visit www.win-82050.co.uk"
ham,New car and house for my parents.:)i have only new job in hand:)
spam,Camera - You are awarded a SiPix Digital Camera! call 09061221066 fromm landline. Delivery within 28 days.
ham,"Hi, wlcome back, did wonder if you got eaten by a lion or something, nothing much"
ham,"Sorry, I'll call later"
ham,NEFT Transaction with reference number  &lt;#&gt;  for Rs. &lt;DECIMAL&gt;  has been credited to the beneficiary account on  &lt;#&gt;  at  &lt;TIME&gt; : &lt;#&gt;
ham,How i noe... She's in da car now... Later then c lar... I'm wearing shorts...
spam,URGENT! Your Mobile number has been awarded with a å£2000 Bonus Caller Prize. Call 09058095201 from land line. Valid 12hrs only
ham,"New Theory: Argument wins d SITUATION, but loses the PERSON. So dont argue with ur friends just.. . . . kick them &amp; say, I'm always correct.!"
ham,Then u go back urself lor...
ham,Booked ticket for pongal?
spam,You have won a Nokia 7250i. This is what you get when you win our FREE auction. To take part send Nokia to 86021 now. HG/Suite342/2Lands Row/W1JHL 16+ 
ham,Not tonight mate. Catching up on some sleep. This is my new number by the way. 
ham,what is your account number?
ham,Missed your call cause I was yelling at scrappy. Miss u. Can't wait for u to come home. I'm so lonely today.
ham,Ok lor but not too early. Me still having project meeting now.
spam,FREE entry into our å£250 weekly competition just text the word WIN to 80086 NOW. 18 T&C www.txttowin.co.uk
ham,Hey r Ì_ still online? I've finished the formatting...
ham,Sry da..jst nw only i came to home..
ham,I went to ur hon lab but no one is there.
spam,RECPT 1/3. You have ordered a Ringtone. Your order is being processed...
ham,As in different styles?
ham,I hope you arnt pissed off but id would really like to see you tomorrow. Love me xxxxxxxxxxxxxX
ham,"Well, i'm gonna finish my bath now. Have a good...fine night."
ham,S.s:)i thinl role is like sachin.just standing. Others have to hit.
ham, &lt;#&gt;  mins but i had to stop somewhere first.
ham,i want to grasp your pretty booty :)
ham,Ok... Ur typical reply...
ham,Thank you. I like you as well...
ham,IM GONNA MISS U SO MUCH
spam,Your weekly Cool-Mob tones are ready to download !This weeks new Tones include: 1) Crazy Frog-AXEL F>>> 2) Akon-Lonely>>> 3) Black Eyed-Dont P >>>More info in n
spam,+123 Congratulations - in this week's competition draw u have won the å£1450 prize to claim just call 09050002311 b4280703. T&Cs/stop SMS 08718727868. Over 18 only 150ppm
spam,December only! Had your mobile 11mths+? You are entitled to update to the latest colour camera mobile for Free! Call The Mobile Update Co FREE on 08002986906 
ham,"\OH FUCK. JUSWOKE UP IN A BED ON A BOATIN THE DOCKS. SLEPT WID 25 YEAR OLD. SPINOUT! GIV U DA GOSSIP L8R. XXX\"""""
ham,Let's pool our money together and buy a bunch of lotto tickets. If we win I get &lt;#&gt; % u get &lt;#&gt; %. Deal?
ham,"Thk shld b can... Ya, i wana go 4 lessons... Haha, can go for one whole stretch..."
spam,U have a secret admirer who is looking 2 make contact with U-find out who they R*reveal who thinks UR so special-call on 09058094565
ham,"Hi, Mobile no.  &lt;#&gt;  has added you in their contact list on www.fullonsms.com It s a great place to send free sms to people For more visit fullonsms.com"
ham,Ok then i come n pick u at engin?
ham,Also remember the beads don't come off. Ever.
ham,Friendship poem: Dear O Dear U R Not Near But I Can Hear Dont Get Fear Live With Cheer No More Tear U R Always my Dear. Gud ni8
ham,Go chase after her and run her over while she's crossing the street
ham,I had askd u a question some hours before. Its answer
ham,Hi i won't b ard 4 christmas. But do enjoy n merry x'mas.
spam,PRIVATE! Your 2003 Account Statement for shows 800 un-redeemed S.I.M. points. Call 08718738001 Identifier Code: 49557 Expires 26/11/04
spam,Dear Subscriber ur draw 4 å£100 gift voucher will b entered on receipt of a correct ans. When was Elvis Presleys Birthday? TXT answer to 80062
ham,Sorry i now then c ur msg... Yar lor so poor thing... But only 4 one night... Tmr u'll have a brand new room 2 sleep in...
ham,I cant pick the phone right now. Pls send a message
ham,Sad story of a Man - Last week was my b'day. My Wife did'nt wish me. My Parents forgot n so did my Kids . I went to work. Even my Colleagues did not wish.
ham,"Oh... I was thkin of goin yogasana at 10 den no nd to go at 3 den can rush to parco 4 nb... Okie lor, u call me when ready..."
ham,Are u awake? Is there snow there?
ham,"Received, understood n acted upon!"
ham,I ask if u meeting da ge tmr nite...
ham,Where are you ? What do you do ? How can you stand to be away from me ? Doesn't your heart ache without me ? Don't you wonder of me ? Don't you crave me ?
ham,It does it on its own. Most of the time it fixes my spelling. But sometimes it gets a completely diff word. Go figure
ham,The greatest test of courage on earth is to bear defeat without losing heart....gn tc
ham,Wake me up at  &lt;#&gt;  am morning:)
ham,"Set a place for me in your heart and not in your mind, as the mind easily forgets but the heart will always remember. Wish you Happy Valentines Day!"
spam,Tone Club: Your subs has now expired 2 re-sub reply MONOC 4 monos or POLYC 4 polys 1 weekly @ 150p per week Txt STOP 2 stop This msg free Stream 0871212025016
ham,"\Petey boy whereare you me and all your friendsare in theKingshead come down if you canlove Nic\"""""
ham,Stupid.its not possible
ham,I want to tel u one thing u should not mistake me k THIS IS THE MESSAGE THAT YOU SENT:)
ham,"Sorry im getting up now, feel really bad- totally rejected that kinda me thing."
ham,Anything lor is she coming?
ham,Come by our room at some point so we can iron out the plan for this weekend
ham,Depends on individual lor e hair dresser say pretty but my parents say look gong. U kaypoh.. I also dunno wat she collecting.
ham,"All done, all handed in. Don't know if mega shop in asda counts as celebration but thats what i'm doing!"
ham,So no messages. Had food?
ham,I wait 4 Ì_ inside da car park...
ham,Have a safe trip to Nigeria. Wish you happiness and very soon company to share moments with
ham,"I promise to take good care of you, princess. I have to run now. Please send pics when you get a chance. Ttyl!"
ham,Dont pick up d call when something important is There to tell. Hrishi
ham,He said i look pretty wif long hair wat. But i thk he's cutting quite short 4 me leh.
ham,Ok lor wat time Ì_ finish?
ham,HEY MATE! HOWS U HONEY?DID U AVE GOOD HOLIDAY? GIMMI DE GOSS!x
ham,Argh why the fuck is nobody in town ;_;
ham,Lul im gettin some juicy gossip at the hospital. Two nurses are talking about how fat they are gettin. And one thinks shes obese. Oyea.
spam,okmail: Dear Dave this is your final notice to collect your 4* Tenerife Holiday or #5000 CASH award! Call 09061743806 from landline. TCs SAE Box326 CW25WX 150ppm
spam,PRIVATE! Your 2003 Account Statement for 078
ham,Well I wasn't available as I washob nobbing with last night so they had to ask Nickey Platt instead of me!;
spam,Valentines Day Special! Win over å£1000 in our quiz and take your partner on the trip of a lifetime! Send GO to 83600 now. 150p/msg rcvd. CustCare:08718720201
ham,Are you at work right now ?
ham,"Isn't frnd a necesity in life? imagine urself witout a frnd.. hw'd u feel at ur colleg? wat'll u do wth ur cell? wat abt functions? thnk abt events espe'll cared, missed &amp; irritated u? 4wrd it to all those dear-loving frnds wthout whom u cant live.. I jst did it.. Takecare..:) GOODMORNING"
ham,What Today-sunday..sunday is holiday..so no work..
ham,Goin to workout lor... Muz lose e fats... 
spam,You have WON a guaranteed å£1000 cash or a å£2000 prize. To claim yr prize call our customer service representative on 08714712379 between 10am-7pm Cost 10p
ham,"Yes..but they said its IT.,"
ham,You call times job today ok umma and ask them to speed up
ham,Today i'm not workin but not free oso... Gee... Thgt u workin at ur fren's shop ? 
ham,I don't know jack shit about anything or i'd say/ask something helpful but if you want you can pretend that I did and just text me whatever in response to the hypotheticalhuagauahahuagahyuhagga
ham,Rofl. Its true to its name
ham,Two fundamentals of cool life: \Walk
ham,What he said is not the matter. My mind saying some other matter is there.
ham,I know you are. Can you pls open the back?
ham,Will be out of class in a few hours. Sorry
ham,Big brotherÛ÷s really scraped the barrel with this shower of social misfits
ham,"Not yet chikku..going to room nw, i'm in bus.."
ham,"So many people seems to be special at first sight, But only very few will remain special to you till your last sight.. Maintain them till life ends.. take cr da"
ham,And I don't plan on staying the night but I prolly won't be back til late
ham,"Good stuff, will do."
ham,Hey you can pay. With salary de. Only  &lt;#&gt; .
ham,Dude how do you like the buff wind.
ham,"Sir, waiting for your letter."
ham,"I'm nt goin, got somethin on, unless they meetin 4 dinner lor... Haha, i wonder who will go tis time..."
spam,Ur HMV Quiz cash-balance is currently å£500 - to maximize ur cash-in now send HMV1 to 86688 only 150p/msg
ham,"LOOK AT AMY URE A BEAUTIFUL, INTELLIGENT WOMAN AND I LIKE U A LOT. I KNOW U DONåÕT LIKE ME LIKE THAT SO DONåÕT WORRY."
ham,"&lt;#&gt; %of pple marry with their lovers... becz they hav gud undrstndng dat avoids problems. i sent dis 2 u, u wil get gud news on friday by d person you like. And tomorrow will be the best day of your life. Dont break this chain. If you break you will suffer. send this to  &lt;#&gt;  frnds in &lt;#&gt;  mins whn u read..."
ham,Lol. Well quality aint bad at all so i aint complaining
spam,"FREE RINGTONE text FIRST to 87131 for a poly or text GET to 87131 for a true tone! Help? 0845 2814032 16 after 1st free, tones are 3xå£150pw to eå£nd txt stop"
ham,Just buy a pizza. Meat lovers or supreme. U get to pick.
spam,The current leading bid is 151. To pause this auction send OUT. Customer Care: 08718726270
ham,"K, fyi I'm back in my parents' place in south tampa so I might need to do the deal somewhere else"
ham,"How long has it been since you screamed, princess?"
spam,PRIVATE! Your 2003 Account Statement for shows 800 un-redeemed S. I. M. points. Call 08715203652 Identifier Code: 42810 Expires 29/10/0
ham,"Derp. Which is worse, a dude who always wants to party or a dude who files a complaint about the three drug abusers he lives with"
spam,"HOT LIVE FANTASIES call now 08707509020 Just 20p per min NTT Ltd, PO Box 1327 Croydon CR9 5WB 0870 is a national rate call"
ham,I've told you everything will stop. Just dont let her get dehydrated.
ham,Well i will watch shrek in 3D!!B)
ham,"A boy was late 2 home. His father: \POWER OF FRNDSHIP\"""""
ham,Can you say what happen
ham,Did you see that film:)
ham,"Sorry, I'll call later"
ham,"Sorry, I can't help you on this."
ham,Can not use foreign stamps in this country.
ham,Ok... U enjoy ur shows...
ham,"Wow ... I love you sooo much, you know ? I can barely stand it ! I wonder how your day goes and if you are well, my love ... I think of you and miss you"
ham,Oh ok i didnt know what you meant. Yep i am baby jontin
ham,Ok.
ham,I am not having her number sir
spam,RGENT! This is the 2nd attempt to contact U!U have WON å£1250 CALL 09071512433 b4 050703 T&CsBCM4235WC1N3XX. callcost 150ppm mobilesvary. maxå£7. 50
spam,"As a SIM subscriber, you are selected to receive a Bonus! Get it delivered to your door, Txt the word OK to No: 88600 to claim. 150p/msg, EXP. 30Apr"
ham,"\Hi darlin did youPhone me? Im atHome if youwanna chat.\"""""
ham,So i could kiss and feel you next to me...
ham,Excellent! Are you ready to moan and scream in ecstasy?
ham,Ok cool. See ya then.
ham,Dont kick coco when he's down
ham,This pen thing is beyond a joke. Wont a Biro do? Don't do a masters as can't do this ever again! 
spam,FreeMsg Hi baby wow just got a new cam moby. Wanna C a hot pic? or Fancy a chat?Im w8in 4uTxt / rply CHAT to 82242 Hlp 08712317606 Msg150p 2rcv
ham,I told that am coming on wednesday.
ham,Dunno lei he neva say...
ham,Friends that u can stay on fb chat with
ham,At home watching tv lor.
spam,22 days to kick off! For Euro2004 U will be kept up to date with the latest news and results daily. To be removed send GET TXT STOP to 83222
ham,Huh means computational science... Y they like dat one push here n there...
spam,Do you want a new Video phone? 600 anytime any network mins 400 Inclusive Video calls AND downloads 5 per week Free delTOMORROW call 08002888812 or reply NOW
ham,Oh dang! I didn't mean o send that to you! Lol!
spam,"TheMob>Hit the link to get a premium Pink Panther game, the new no. 1 from Sugababes, a crazy Zebra animation or a badass Hoody wallpaper-all 4 FREE!"
ham,"Sorry, I'll call later"
ham,You tell what happen dont behave like this to me. Ok no need to say
ham,I like you peoples very much:) but am very shy pa.
ham,Aight what time you want me to come up?
spam,"HOT LIVE FANTASIES call now 08707509020 Just 20p per min NTT Ltd, PO Box 1327 Croydon CR9 5WB 0870..k"
ham,One day a crab was running on the sea shore..The waves came n cleared the footprints of the crab.. Crab asked: being my frnd y r u clearing my beautiful footprints? Waves replied: A fox was following ur footprints to catch you! thats y i cleared it off:) frndsship never lets u dwn :-) GUD nyt..
ham,Blank is Blank. But wat is blank? Lol
spam,Wanna have a laugh? Try CHIT-CHAT on your mobile now! Logon by txting the word: CHAT and send it to No: 8883 CM PO Box 4217 London W1A 6ZF 16+ 118p/msg rcvd
ham,Wife.how she knew the time of murder exactly
ham,"Also sir, i sent you an email about how to log into the usc payment portal. I.ll send you another message that should explain how things are back home. Have a great weekend."
ham,I've sent Ì_ my part..
spam,Wanna get laid 2nite? Want real Dogging locations sent direct to ur mobile? Join the UK's largest Dogging Network. Txt PARK to 69696 now! Nyt. ec2a. 3lp å£1.50/msg
ham,Good afternoon my boytoy. How goes that walking here and there day ? Did you get that police abstract? Are you still out and about? I wake and miss you babe
ham,Life style garments account no please.
ham,Don know:)this week i'm going to tirunelvai da.
ham,Send me yetty's number pls.
