target,text
ham,"Can you pls pls send me a mail on all you know about relatives coming to deliver here? All you know about costs, risks, benefits and anything else. Thanks."
ham,"Oh, my love, it's soooo good to hear from you. Omg I missed you so much today. I'm sorry your having problems with the provider but thank you for tming me"
ham,Many times we lose our best ones bcoz we are 
ham,"A Boy loved a gal. He propsd bt she didnt mind. He gv lv lttrs, Bt her frnds threw thm. Again d boy decided 2 aproach d gal , dt time a truck was speeding towards d gal. Wn it was about 2 hit d girl,d boy ran like hell n saved her. She asked 'hw cn u run so fast?' D boy replied \Boost is d secret of my energy\"" n instantly d girl shouted \""our energy\"" n Thy lived happily 2gthr drinking boost evrydy Moral of d story:- I hv free msgs:D;): gud ni8"""
ham,Does not operate after  &lt;#&gt;  or what
ham,K go and sleep well. Take rest:-).
ham,Are you staying in town ?
ham,Jus ans me lar. U'll noe later.
spam,Please call our customer service representative on FREEPHONE 0808 145 4742 between 9am-11pm as you have WON a guaranteed å£1000 cash or å£5000 prize!
ham,Lol now I'm after that hot air balloon!
ham,And he's apparently bffs with carly quick now
ham,Lol no. Just trying to make your day a little more interesting
ham,2marrow only. Wed at  &lt;#&gt;  to 2 aha.
ham,Y Ì_ wan to go there? C doctor?
ham,"A famous quote : when you develop the ability to listen to 'anything' unconditionally without losing your temper or self confidence, it means you are ......... 'MARRIED'"
ham,Two teams waiting for some players
ham,Dont know supports ass and srt i thnk. I think ps3 can play through usb too
spam,"Did you hear about the new \Divorce Barbie\""? It comes with all of Ken's stuff!"""
ham,Esplanade lor. Where else...
ham,"I keep seeing weird shit and bein all \woah\"" then realising it's actually reasonable and I'm all \""oh\"""""
ham,Ok. C u then.
ham,Should I be stalking u?
ham,No plans yet. What are you doing ?
spam,Hi 07734396839 IBH Customer Loyalty Offer: The NEW NOKIA6600 Mobile from ONLY å£10 at TXTAUCTION!Txt word:START to No:81151 & get Yours Now!4T&
ham,Leave it. U will always be ignorant.
ham,I take it we didn't have the phone callon Friday. Can we assume we won't have it this year now?
ham,When did you get to the library
ham,"I'm in a meeting, call me later at"
ham,"Yeah, don't go to bed, I'll be back before midnight"
ham,Oic... Then better quickly go bathe n settle down...
ham,"Geeeee ... Your internet is really bad today, eh ?"
spam,"As a valued customer, I am pleased to advise you that following recent review of your Mob No. you are awarded with a å£1500 Bonus Prize, call 09066364589"
ham,What I'm saying is if you haven't explicitly told nora I know someone I'm probably just not gonna bother
ham,DO U WANT 2 MEET UP 2MORRO
spam,"YOU VE WON! Your 4* Costa Del Sol Holiday or å£5000 await collection. Call 09050090044 Now toClaim. SAE, TC s, POBox334, Stockport, SK38xh, Costå£1.50/pm, Max10mins"
ham,"No idea, I guess we'll work that out an hour after we're supposed to leave since as usual nobody has any interest in figuring shit out before the last second"
spam,"Congrats! 2 mobile 3G Videophones R yours. call 09061744553 now! videochat wid ur mates, play java games, Dload polyH music, noline rentl. bx420. ip4. 5we. 150pm"
ham,Lolnice. I went from a fish to ..water.?
ham,Thats cool princess! I will cover your face in hot sticky cum :)
ham,Hi its in durban are you still on this number
ham,"Plz note: if anyone calling from a mobile Co. &amp; asks u to type # &lt;#&gt;  or # &lt;#&gt; . Do not do so. Disconnect the call,coz it iz an attempt of 'terrorist' to make use of the sim card no. Itz confirmd by nokia n motorola n has been verified by CNN IBN."
ham,Well obviously not because all the people in my cool college life went home ;_;
ham,LOOK AT THE FUCKIN TIME. WHAT THE FUCK YOU THINK IS UP
ham,R u meeting da ge at nite tmr?
ham,Cbe is really good nowadays:)lot of shop and showrooms:)city is shaping good.
ham,I've got it down to a tea. not sure which flavour
ham,"Hey babe, sorry i didn't get sooner. Gary can come and fix it cause he thinks he knows what it is but he doesn't go as far a Ptbo and he says it will cost  &lt;#&gt;  bucks. I don't know if it might be cheaper to find someone there ? We don't have any second hand machines at all right now, let me know what you want to do babe"
ham,"Hi, can i please get a  &lt;#&gt;  dollar loan from you. I.ll pay you back by mid february. Pls."
ham,How much is torch in 9ja.
ham,* You gonna ring this weekend or wot?
spam,Dont forget you can place as many FREE Requests with 1stchoice.co.uk as you wish. For more Information call 08707808226.
ham,Lmao ok I wont be needing u to do my hair anymore.
spam,Had your mobile 11 months or more? U R entitled to Update to the latest colour mobiles with camera for Free! Call The Mobile Update Co FREE on 08002986030
ham,Alright. I'm out--have a good night!
ham,Wat's da model num of ur phone?
ham,"And very importantly, all we discuss is between u and i only."
ham,"\HEY DAS COOL... IKNOW ALL 2 WELLDA PERIL OF STUDENTFINANCIAL CRISIS!SPK 2 U L8R.\"""""
ham,I love to cuddle! I want to hold you in my strong arms right now...
ham,I absolutely LOVE South Park! I only recently started watching the office.
ham,Yes! How is a pretty lady like you single?
ham,But my family not responding for anything. Now am in room not went to home for diwali but no one called me and why not coming. It makes me feel like died.
ham,Was it something u ate?
ham,Dont flatter yourself... Tell that man of mine two pints of carlin in ten minutes please.... 
spam,+449071512431 URGENT! This is the 2nd attempt to contact U!U have WON å£1250 CALL 09071512433 b4 050703 T&CsBCM4235WC1N3XX. callcost 150ppm mobilesvary. maxå£7. 50
spam,Sex up ur mobile with a FREE sexy pic of Jordan! Just text BABE to 88600. Then every wk get a sexy celeb! PocketBabe.co.uk 4 more pics. 16 å£3/wk 087016248
ham,Anything lar then Ì_ not going home 4 dinner?
ham,Easy ah?sen got selected means its good..
ham,Height of Confidence: All the Aeronautics professors wer calld &amp; they wer askd 2 sit in an aeroplane. Aftr they sat they wer told dat the plane ws made by their students. Dey all hurried out of d plane.. Bt only 1 didnt move... He said:\if it is made by my students
ham,No..jst change tat only..
ham,Hey they r not watching movie tonight so i'll prob b home early...
ham,Hello my little party animal! I just thought I'd buzz you as you were with your friends ...*grins*... Reminding you were loved and send a naughty adoring kiss
ham,Good. No swimsuit allowed :)
ham,Sian... Aft meeting supervisor got work 2 do liao... U working now?
ham,Aah bless! How's your arm?
ham,Play w computer? Aiyah i tok 2 u lor?
ham,Pls call me da. What happen.
ham,Meanwhile in the shit suite: xavier decided to give us  &lt;#&gt;  seconds of warning that samantha was coming over and is playing jay's guitar to impress her or some shit. Also I don't think doug realizes I don't live here anymore
ham,Am on a train back from northampton so i'm afraid not! I'm staying skyving off today ho ho! Will be around wednesday though. Do you fancy the comedy club this week by the way?
ham,Hi' Test on  &lt;#&gt; rd ....
spam,"Your free ringtone is waiting to be collected. Simply text the password \MIX\"" to 85069 to verify. Get Usher and Britney. FML"
ham,cool. We will have fun practicing making babies!
ham,I sent your maga that money yesterday oh.
ham,Jokin only lar... :-) depends on which phone my father can get lor...
ham,"Ya ok, then had dinner?"
ham,Can you plz tell me the ans. BSLVYL sent via fullonsms.com
ham,Oh k:)after that placement there ah?
ham,"Yup, leaving right now, be back soon"
ham,Oh baby of the house. How come you dont have any new pictures on facebook
spam,Your B4U voucher w/c 27/03 is MARSMS. Log onto www.B4Utele.com for discount credit. To opt out reply stop. Customer care call 08717168528
ham,So its to be poking man everyday that they teach you in canada abi! How are you. Just saying hi.
ham,I want kfc its Tuesday. Only buy 2 meals ONLY 2. No gravy. Only 2 Mark. 2!
ham,What time. IÛ÷m out until prob 3 or so
ham,No screaming means shouting..
ham,Miss call miss call khelate kintu opponenter miss call dhorte lage. Thats d rule. One with great phone receiving quality wins.
ham,I havent lei.. Next mon can?
ham,"Oh fine, I'll be by tonight"
ham,Can you call me plz. Your number shows out of coveragd area. I have urgnt call in vasai &amp; have to reach before 4'o clock so call me plz
ham,Its too late:)but its k.wish you the same.
spam,"Last Chance! Claim ur å£150 worth of discount vouchers today! Text SHOP to 85023 now! SavaMob, offers mobile! T Cs SavaMob POBOX84, M263UZ. å£3.00 Sub. 16"
ham,Dear where you will be when i reach there
ham,Do u still have plumbers tape and a wrench we could borrow?
spam,SMS SERVICES For your inclusive text credits pls gotto www.comuk.net login 3qxj9 unsubscribe with STOP no extra charge help 08702840625 comuk.220cm2 9AE
ham,We are pleased to inform that your application for Airtel Broadband is processed successfully. Your installation will happen within 3 days.
ham,"Very strange.  and  are watching the 2nd one now but i'm in bed. Sweet dreams, miss u "
ham,So dont use hook up any how
spam,Message Important information for O2 user. Today is your lucky day! 2 find out why log onto http://www.urawinner.com there is a fantastic surprise awaiting you
ham,You could have seen me..i did't recognise you Face.:)
ham,The 2 oz guy is being kinda flaky but one friend is interested in picking up $ &lt;#&gt;  worth tonight if possible
ham,I can do that! I want to please you both inside and outside the bedroom...
ham,"A few people are at the game, I'm at the mall with iouri and kaila"
ham,No da:)he is stupid da..always sending like this:)don believe any of those message.pandy is a mental:)
ham,I dont want to hear philosophy. Just say what happen
ham,ÌÏ mean it's confirmed... I tot they juz say oni... Ok then... 
ham,meet you in corporation st outside gap Û_ you can see how my mind is working!
ham,Hey we can go jazz power yoga hip hop kb and yogasana 
ham,IM GONNAMISSU SO MUCH!!I WOULD SAY IL SEND U A POSTCARD BUTTHERES ABOUTAS MUCH CHANCE OF MEREMEMBERIN ASTHERE IS OFSI NOT BREAKIN HIS CONTRACT!! LUV Yaxx
ham,"A bit of Ur smile is my hppnss, a drop of Ur tear is my sorrow, a part of Ur heart is my life, a heart like mine wil care for U, forevr as my GOODFRIEND"
ham,At WHAT TIME should i come tomorrow
spam,Moby Pub Quiz.Win a å£100 High Street prize if u know who the new Duchess of Cornwall will be? Txt her first name to 82277.unsub STOP å£1.50 008704050406 SP Arrow
ham,Dunno leh cant remember mayb lor. So wat time r we meeting tmr?
spam,GENT! We are trying to contact you. Last weekends draw shows that you won a å£1000 prize GUARANTEED. Call 09064012160. Claim Code K52. Valid 12hrs only. 150ppm 
ham,Hope you are having a great day.
ham,Sorry dude. Dont know how i forgot. Even after Dan reminded me. Sorry. Hope you guys had fun.
ham,"not that I know of, most people up here are still out of town"
ham,Am watching house ÛÒ very entertaining ÛÒ am getting the whole hugh laurie thing ÛÒ even with the stick ÛÒ indeed especially with the stick.
ham,Olol i printed out a forum post by a guy with the exact same  prob which was fixed with a gpu replacement. Hopefully they dont ignore that.
ham,Hi. I'm sorry i missed your call. Can you pls call back.
ham,Can you please send me my aunty's number
ham,Then why you came to hostel.
spam,HMV BONUS SPECIAL 500 pounds of genuine HMV vouchers to be won. Just answer 4 easy questions. Play Now! Send HMV to 86688 More info:www.100percent-real.com
ham,By monday next week. Give me the full gist
ham,K:)k:)what are detail you want to transfer?acc no enough?
spam,"Latest News! Police station toilet stolen, cops have nothing to go on!"
ham,"Alright we're hooked up, where you guys at"
ham,I've reached home n i bathe liao... U can call me now...
ham,Omg I want to scream. I weighed myself and I lost more weight! Woohoo!
ham,"Sure thing big man. i have hockey elections at 6, shouldnÛ÷t go on longer than an hour though"
ham,He telling not to tell any one. If so treat for me hi hi hi
spam,URGENT We are trying to contact you Last weekends draw shows u have won a å£1000 prize GUARANTEED Call 09064017295 Claim code K52 Valid 12hrs 150p pm
ham,"Sorry, I'll call later"
ham,Annoying isn't it.
ham,When should I come over?
ham,"Oh ! A half hour is much longer in Syria than Canada, eh ? Wow you must get SO much more work done in a day than us with all that extra time ! *grins*"
ham,o turns out i had stereo love on mi phone under the unknown album.
ham,Is it your yahoo boys that bring in the perf? Or legal.
ham,"By the way, 'rencontre' is to meet again. Mountains dont...."
ham,I cant keep talking to people if am not sure i can pay them if they agree to price. So pls tell me what you want to really buy and how much you are willing to pay
ham,Hmmm...k...but i want to change the field quickly da:-)i wanna get system administrator or network administrator..
ham,We will meet soon princess! Ttyl!
ham,I want  &lt;#&gt;  rs da:)do you have it?
ham,Hope you are having a great day.
ham,Where is that one day training:-)
ham,"Tell you what, if you make a little spreadsheet and track whose idea it was to smoke to determine who \smokes too much\"" for the entire month of february"
ham,I'm at work. Please call
ham,Havent shopping now lor i juz arrive only
ham,Jesus armand really is trying to tell everybody he can find
spam,"YOU 07801543489 are guaranteed the latests Nokia Phone, a 40GB iPod MP3 player or a å£500 prize! Txt word:COLLECT to No:83355! TC-LLC NY-USA 150p/Mt msgrcvd18+"
spam,Call from 08702490080 - tells u 2 call 09066358152 to claim å£5000 prize. U have 2 enter all ur mobile & personal details @ the prompts. Careful!
ham,"Aight, see you in a bit"
ham,"Sorry I flaked last night, shit's seriously goin down with my roommate, what you up to tonight?"
ham,Midnight at the earliest
spam,Congratulations ur awarded either å£500 of CD gift vouchers & Free entry 2 our å£100 weekly draw txt MUSIC to 87066 TnCs www.Ldew.com 1 win150ppmx3age16
ham,Yup
ham,:-) yeah! Lol. Luckily i didn't have a starring role like you!
ham,Don no da:)whats you plan?
ham,Already am squatting is the new way of walking
ham,I think if he rule tamilnadu..then its very tough for our people.
ham,Tell dear what happen to you. Why you talking to me like an alian
ham,That sucks. I'll go over so u can do my hair. You'll do it free right?
ham,I am on the way to ur home
ham,"Fuck babe ... I miss you already, you know ? Can't you let me send you some money towards your net ? I need you ... I want you ... I crave you ..."
ham,Jus finish blowing my hair. U finish dinner already?
ham,I cant pick the phone right now. Pls send a message
ham,I am joining today formally.Pls keep praying.will talk later.
ham,He is there. You call and meet him
ham,Are you going to write ccna exam this week??
ham,Future is not what we planned for tomorrow.....! it is the result of what we do today...! Do the best in present... enjoy the future.
ham,Not from this campus. Are you in the library?
ham,"Ever green quote ever told by Jerry in cartoon \A Person Who Irritates u Always Is the one Who Loves u Vry Much But Fails to Express It...!..!! :-) :-) gud nyt"""
ham,I cant pick the phone right now. Pls send a message
ham,Lol for real. She told my dad I have cancer
ham,Nope but i'll b going 2 sch on fri quite early lor cos mys sis got paper in da morn :-)
ham,Cab is available.they pick up and drop at door steps.
ham,Its sarcasm.. .nt scarcasim
ham,"Single line with a big meaning::::: \Miss anything 4 ur \""Best Life\"" but"
ham,"ItÛ÷s reassuring, in this crazy world."
ham,Somebody should go to andros and steal ice
ham,Lol ok ill try to send. Be warned Sprint is dead slow. You'll prolly get it tomorrow
ham,Are u coming to the funeral home
ham,Sorry completely forgot * will pop em round this week if your still here?
ham,Hey next sun 1030 there's a basic yoga course... at bugis... We can go for that... Pilates intro next sat.... Tell me what time you r free
ham,Serious? What like proper tongued her
ham,Aiyar hard 2 type. U later free then tell me then i call n scold n tell u.
ham,I keep ten rs in my shelf:) buy two egg.
ham,I am in escape theatre now. . Going to watch KAVALAN in a few minutes
ham,"Sorry, I'll call later"
ham,Wow so healthy. Old airport rd lor. Cant thk of anything else. But i'll b bathing my dog later.
ham,"Haha awesome, be there in a minute"
ham,What happened to our yo date?
ham,It has everything to do with the weather. Keep extra warm. Its a cold but nothing serious. Pls lots of vitamin c
ham,"Awesome, text me when you're restocked"
spam,Want 2 get laid tonight? Want real Dogging locations sent direct 2 ur Mob? Join the UK's largest Dogging Network by txting MOAN to 69888Nyt. ec2a. 31p.msg@150p
ham,Well I might not come then...
ham,Yup... I havent been there before... You want to go for the yoga? I can call up to book 
spam,"Sunshine Hols. To claim ur med holiday send a stamped self address envelope to Drinks on Us UK, PO Box 113, Bray, Wicklow, Eire. Quiz Starts Saturday! Unsub Stop"
ham,Watch lor. I saw a few swatch one i thk quite ok. Ard 116 but i need 2nd opinion leh...
ham,Wat time Ì_ finish?
spam,"If you don't, your prize will go to another customer. T&C at www.t-c.biz 18+ 150p/min Polo Ltd Suite 373 London W1J 6HL Please call back if busy"
ham,Thats cool! Sometimes slow and gentle. Sonetimes rough and hard :)
ham,Ok...
ham,Thanks honey. Have a great day.
ham,Thank god they are in bed!
ham,I had it already..sabarish asked me to go..
ham,Wot is u up 2 then bitch?
ham,Our Prashanthettan's mother passed away last night. pray for her and family.
ham,"Sad story of a Man - Last week was my b'day. My Wife did'nt wish me. My Parents forgot n so did my Kids . I went to work. Even my Colleagues did not wish. As I entered my cabin my PA said, '' Happy B'day Boss !!''. I felt special. She askd me 4 lunch. After lunch she invited me to her apartment. We went there. She said,'' do u mind if I go into the bedroom for a minute ? '' ''OK'', I sed in a sexy mood. She came out 5 minuts latr wid a cake...n My Wife, My Parents, My Kidz, My Friends n My Colleagues. All screaming.. SURPRISE !! and I was waiting on the sofa.. ... ..... ' NAKED...!"
ham,HI ITS JESS I DONT KNOW IF YOU ARE AT WORK BUT CALL ME WHEN U CAN IM AT HOME ALL EVE. XXX
ham,HOW ARE U? I HAVE MISSED U! I HAVENT BEEN UP 2 MUCH A BIT BORED WITH THE HOLIDAY WANT 2 GO BAK 2 COLLEGE! SAD ISNT IT?xx
spam,Loans for any purpose even if you have Bad Credit! Tenants Welcome. Call NoWorriesLoans.com on 08717111821
spam,ASKED 3MOBILE IF 0870 CHATLINES INCLU IN FREE MINS. INDIA CUST SERVs SED YES. L8ER GOT MEGA BILL. 3 DONT GIV A SHIT. BAILIFF DUE IN DAYS. I O å£250 3 WANT å£800
ham,I'm home. Ard wat time will u reach?
ham,Dear umma she called me now :-)
spam,U have a secret admirer. REVEAL who thinks U R So special. Call 09065174042. To opt out Reply REVEAL STOP. 1.50 per msg recd. Cust care 07821230901
ham,Yup. Thk of u oso boring wat.
ham,Ok ok take care. I can understand.
ham,I'll be in sch fr 4-6... I dun haf da book in sch... It's at home...
ham,Pls come quick cant bare this.
ham,Yeah that'd pretty much be the best case scenario
ham,Just woke up. Yeesh its late. But I didn't fall asleep til &lt;#&gt; am :/
ham,No it will reach by 9 only. She telling she will be there. I dont know
ham,"Christmas is An occasion that is Celebrated as a Reflection of UR... Values..., Desires..., Affections...&amp; Traditions.... Have an ideal Christmas..."
ham,HCL chennai requires FRESHERS for voice process.Excellent english needed.Salary upto  &lt;#&gt; .Call Ms.Suman  &lt;#&gt;  for Telephonic interview -via Indyarocks.com
ham,I'm at home. Please call
spam,You have won a Nokia 7250i. This is what you get when you win our FREE auction. To take part send Nokia to 86021 now. HG/Suite342/2Lands Row/W1JHL 16+
spam,"For ur chance to win a å£250 cash every wk TXT: ACTION to 80608. T's&C's www.movietrivia.tv custcare 08712405022, 1x150p/wk."
ham,I did. One slice and one breadstick. Lol
ham,HI DARLIN HOW WAS WORK DID U GET INTO TROUBLE? IJUST TALKED TO YOUR MUM ALL MORNING! I HAD A REALLY GOOD TIME LAST NIGHT IM GOIN OUT SOON BUT CALL ME IF U CAN
ham,"I don't have anybody's number, I still haven't thought up a tactful way to ask alex"
ham,Ambrith..madurai..met u in arun dha marrge..remembr?
ham,Hi its Kate how is your evening? I hope i can see you tomorrow for a bit but i have to bloody babyjontet! Txt back if u can. :) xxx
ham,Thanx but my birthday is over already.
ham,She told to hr that he want posting in chennai:)because i'm working here:)
spam,Check Out Choose Your Babe Videos @ sms.shsex.netUN fgkslpoPW fgkslpo
ham,Mind blastin.. No more Tsunamis will occur from now on.. Rajnikant stopped swimming in Indian Ocean..:-D
ham,My sort code is  and acc no is . The bank is natwest. Can you reply to confirm i've sent this to the right person!
ham,But i'm really really broke oh. No amount is too small even  &lt;#&gt; 
ham,Got it. Seventeen pounds for seven hundred ml ÛÒ hope ok.
ham,K.k:)when are you going?
spam,Congratulations ur awarded 500 of CD vouchers or 125gift guaranteed & Free entry 2 100 wkly draw txt MUSIC to 87066
ham,Are you sure you don't mean \get here
ham,We confirm eating at esplanade?
ham,How are you. Wish you a great semester
ham,Thanks for looking out for me. I really appreciate.
ham,I'm reading the text i just sent you. Its meant to be a joke. So read it in that light
ham,"I just got home babe, are you still awake ?"
ham,Hi msg me:)i'm in office..
ham,"Tyler (getting an 8th) has to leave not long after 9, can you get here in like an hour?"
ham,Hmm...my uncle just informed me that he's paying the school directly. So pls buy food.
ham,Guessin you ain't gonna be here before 9?
ham,Sweet heart how are you?
ham,I can't describe how lucky you are that I'm actually awake by noon
ham,Ok ill send you with in  &lt;DECIMAL&gt;  ok.
ham,"I wonder if your phone battery went dead ? I had to tell you, I love you babe"
spam,Ur cash-balance is currently 500 pounds - to maximize ur cash-in now send GO to 86688 only 150p/meg. CC: 08718720201 HG/Suite342/2lands Row/W1j6HL
ham,"Awesome, I'll see you in a bit"
ham,K:)k..its good:)when are you going?
ham,"Urgh, coach hot, smells of chip fat! Thanks again, especially for the duvet (not a predictive text word)."
ham,Free any day but i finish at 6 on mon n thurs...
ham,What happen dear. Why you silent. I am tensed
ham,Don know. I did't msg him recently.
ham,Hey i will be late... i'm at amk. Need to drink tea or coffee
ham,And now electricity just went out fml.
ham,Dun b sad.. It's over.. Dun thk abt it already. Concentrate on ur other papers k.
ham,Daddy will take good care of you :)
spam,"Shop till u Drop, IS IT YOU, either 10K, 5K, å£500 Cash or å£100 Travel voucher, Call now, 09064011000. NTT PO Box CR01327BT fixedline Cost 150ppm mobile vary"
ham,"Call me. I m unable to cal. Lets meet bhaskar, and deep"
ham,Call me when u finish then i come n pick u.
spam,I don't know u and u don't know me. Send CHAT to 86688 now and let's find each other! Only 150p/Msg rcvd. HG/Suite342/2Lands/Row/W1J6HL LDN. 18 years or over.
ham,Ok thanx...
spam,URGENT! We are trying to contact U. Todays draw shows that you have won a å£800 prize GUARANTEED. Call 09050001808 from land line. Claim M95. Valid12hrs only
ham,You said not now. No problem. When you can. Let me know.
ham,You've already got a flaky parent. It'snot supposed to be the child's job to support the parent...not until they're The Ride age anyway. I'm supposed to be there to support you. And now i've hurt you. unintentional. But hurt nonetheless.
ham,"Oh yes, why is it like torture watching england?"
ham,"Yep, by the pretty sculpture"
ham,K..i deleted my contact that why?
ham,THANX 4 PUTTIN DA FONE DOWN ON ME!!
ham,I want to see your pretty pussy...
ham,Hi. I'm always online on yahoo and would like to chat with you someday
ham,"Hiya, probably coming home * weekend after next"
ham,R u here yet? I'm wearing blue shirt n black pants.
ham,Finished class where are you.
ham,My friends use to call the same.
ham,Dont gimme that lip caveboy
ham,Just re read it and I have no shame but tell me how he takes it and if he runs I will blame u 4 ever!! Not really 4 ever just a long time 
ham,Lol ok. I'll snatch her purse too.
ham,I am on the way to ur home
ham,Hope you are having a good week. Just checking in
ham,Hows the street where the end of library walk is?
ham,S s..first time..dhoni rocks...
ham,"Sorry, I'll call later"
ham,"I'm not smoking while people use \wylie smokes too much\"" to justify ruining my shit"""
ham,Only 2% students solved this CAT question in 'xam... 5+3+2= &lt;#&gt;  9+2+4= &lt;#&gt;  8+6+3= &lt;#&gt;  then 7+2+5=????? Tell me the answer if u r brilliant...1thing.i got d answr.
ham,Howz pain.it will come down today.do as i said ystrday.ice and medicine.
ham,Thinkin about someone is all good. No drugs for that
ham,"Yes obviously, but you are the eggs-pert and the potato headÛ_ Speak soon! "
ham,Mm so you asked me not to call radio
spam,PRIVATE! Your 2003 Account Statement for shows 800 un-redeemed S. I. M. points. Call 08718738002 Identifier Code: 48922 Expires 21/11/04
ham,Pls go there today  &lt;#&gt; . I dont want any excuses
ham,Networking job is there.
