target,text
spam,"Urgent! call 09066350750 from your landline. Your complimentary 4* Ibiza Holiday or 10,000 cash await collection SAE T&Cs PO BOX 434 SK3 8WP 150 ppm 18+ "
ham,Eh u send wrongly lar...
spam,"\For the most sparkling shopping breaks from 45 per person; call 0121 2025050 or visit www.shortbreaks.org.uk\"""""
ham,Hmm. Shall i bring a bottle of wine to keep us amused? Just joking! I'll still bring a bottle. Red or white? See you tomorrow
spam,Freemsg: 1-month unlimited free calls! Activate SmartCall Txt: CALL to No: 68866. Subscriptn3gbp/wk unlimited calls Help: 08448714184 Stop?txt stop landlineonly
ham,My sister going to earn more than me da.
ham,"Me not waking up until 4 in the afternoon, sup"
spam,Your credits have been topped up for http://www.bubbletext.com Your renewal Pin is tgxxrz
ham,"Sorry, I can't help you on this."
ham,Only if you promise your getting out as SOON as you can. And you'll text me in the morning to let me know you made it in ok.
ham,Guess who spent all last night phasing in and out of the fourth dimension
ham,Omg Joanna is freaking me out. She's looked thru all my friends to find photos of me. And then she's asking about stuff on my MySpace which I haven't even logged on in like a year. :/
ham,Please tell me not all of my car keys are in your purse
ham,Geeeee ... I love you so much I can barely stand it
ham,WOT STUDENT DISCOUNT CAN U GET ON BOOKS?
ham,Wait.i will come out.. &lt;#&gt;  min:)
ham,Imagine Life WITHOUT ME... see.. How fast u are searching me?Don't worry.. l'm always there To disturb U.. Goodnoon..:)
ham,Thanks for yesterday sir. You have been wonderful. Hope you enjoyed the burial. MojiBiola
ham,"Sorry, I'll call later"
spam,"Our dating service has been asked 2 contact U by someone shy! CALL 09058091870 NOW all will be revealed. POBox84, M26 3UZ 150p"
ham,Reading gud habit.. Nan bari hudgi yorge pataistha ertini kano:-)
ham,No message..no responce..what happend?
spam,YES! The only place in town to meet exciting adult singles is now in the UK. Txt CHAT to 86688 now! 150p/Msg.
spam,"SMS SERVICES. for your inclusive text credits, pls goto www.comuk.net login= ***** unsubscribe with STOP. no extra charge. help:08700469649. PO BOX420. IP4 5WE"
ham,Hey mr whats the name of that bill brison book the one about language and words 
ham,S da..al r above  &lt;#&gt;
ham,"I can probably come by, everybody's done around  &lt;#&gt;  right?"
ham,"Ok da, i already planned. I wil pick you."
ham,I jus reached home. I go bathe first. But my sis using net tell u when she finishes k...
ham,How will I creep on you now? ;_;
ham,"Turns out my friends are staying for the whole show and won't be back til ~ &lt;#&gt; , so feel free to go ahead and smoke that $ &lt;#&gt;  worth"
ham,"New Theory: Argument wins d SITUATION, but loses the PERSON. So dont argue with ur friends just.. . . . kick them &amp; say, I'm always correct.!"
ham,I have no idea where you are
ham,No you'll just get a headache trying to figure it out. U can trust me to do the math. I promise. O:-)
ham,"Just wondering, the others just took off"
ham,"Yo, call me when you get the chance, a friend of mine wanted me to ask you about a big order"
ham,"Hurry up, I've been weed-deficient for like three days"
ham,Lara said she can loan me  &lt;#&gt; .
ham,"No worries, hope photo shoot went well. have a spiffing fun at workage. "
ham,"IÛ÷ve got some salt, you can rub it in my open wounds if you like!"
ham,K. I will sent it again
ham,Every day i use to sleep after  &lt;#&gt;  so only.
ham,ÌÏ predict wat time Ì_'ll finish buying?
ham,Yup...
ham,\HEY BABE! FAR 2 SPUN-OUT 2 SPK AT DA MO... DEAD 2 DA WRLD. BEEN SLEEPING ON DA SOFA ALL DAY
ham,Call him and say you not coming today ok and tell them not to fool me like this ok
ham,Oh. U must have taken your REAL Valentine out shopping first.
ham,Lol that's different. I don't go trying to find every real life photo you ever took.
ham,Shhhhh nobody is supposed to know!
ham,Mm i am on the way to railway
ham,THING R GOOD THANX GOT EXAMS IN MARCH IVE DONE NO REVISION? IS FRAN STILL WITH BOYF? IVE GOTTA INTERVIW 4 EXETER BIT WORRIED!x
ham,That's the way you should stay oh.
spam,PRIVATE! Your 2003 Account Statement for shows 800 un-redeemed S. I. M. points. Call 08715203694 Identifier Code: 40533 Expires 31/10/04
ham,So li hai... Me bored now da lecturer repeating last weeks stuff waste time... 
ham,Please tell me you have some of that special stock you were talking about
spam,"You are being contacted by our Dating Service by someone you know! To find out who it is, call from your mobile or landline 09064017305 PoBox75LDNS7 "
ham,"Say this slowly.? GOD,I LOVE YOU &amp; I NEED YOU,CLEAN MY HEART WITH YOUR BLOOD.Send this to Ten special people &amp; u c miracle tomorrow, do it,pls,pls do it..."
spam,Thanks for the Vote. Now sing along with the stars with Karaoke on your mobile. For a FREE link just reply with SING now.
ham,"Aight, I'm chillin in a friend's room so text me when you're on the way"
ham,Good Morning plz call me sir
ham,"My life Means a lot to me, Not because I love my life, But because I love the people in my life, The world calls them friends, I call them my World:-).. Ge:-).."
spam,RT-KIng Pro Video Club>> Need help? info@ringtoneking.co.uk or call 08701237397 You must be 16+ Club credits redeemable at www.ringtoneking.co.uk! Enjoy!
ham,Yes just finished watching days of our lives. I love it.
ham,Just finished. Missing you plenty
ham,Thts wat Wright Brother did to fly..
ham,U 2.
ham,"Sorry, I'll call later"
ham,Did u fix the teeth?if not do it asap.ok take care.
ham,Horrible u eat macs eat until u forgot abt me already rite... U take so long 2 reply. I thk it's more toot than b4 so b prepared. Now wat shall i eat?
spam,FreeMsg: Fancy a flirt? Reply DATE now & join the UKs fastest growing mobile dating service. Msgs rcvd just 25p to optout txt stop to 83021. Reply DATE now!
ham,So how are you really. What are you up to. How's the masters. And so on.
ham,How's it feel? Mr. Your not my real Valentine just my yo Valentine even tho u hardly play!!
ham,Thts god's gift for birds as humans hav some natural gift frm god..
ham,Are you this much buzy
spam,Bloomberg -Message center +447797706009 Why wait? Apply for your future http://careers. bloomberg.com
ham,I'm sick !! I'm needy !! I want you !! *pouts* *stomps feet* Where are you ?! *pouts* *stomps feet* I want my slave !! I want him now !!
ham,"He has lots of used ones babe, but the model doesn't help. Youi have to bring it over and he'll match it up"
ham,Another month. I need chocolate weed and alcohol.
ham,Dunno lei... I thk mum lazy to go out... I neva ask her yet...
ham,Oops i thk i dun haf enuff... I go check then tell Ì_..
ham,"Good afternoon, babe. How goes that day ? Any job prospects yet ? I miss you, my love ... *sighs* ... :-("
ham,I have lost 10 kilos as of today!
ham,Convey my regards to him
spam,You have an important customer service announcement from PREMIER. Call FREEPHONE 0800 542 0578 now!
ham,Sounds like something that someone testing me would sayy
ham,Do you know when the result.
ham,Just got up. have to be out of the room very soon. Û_. i hadn't put the clocks back til at 8 i shouted at everyone to get up and then realised it was 7. wahay. another hour in bed.
ham,That means from february to april i'll be getting a place to stay down there so i don't have to hustle back and forth during audition season as i have since my sister moved away from harlem.
spam,"Hello from Orange. For 1 month's free access to games, news and sport, plus 10 free texts and 20 photo messages, reply YES. Terms apply: www.orange.co.uk/ow"
ham,Ok . . now i am in bus. . If i come soon i will come otherwise tomorrow
ham,Oh is it? Send me the address
ham,I thk 50 shd be ok he said plus minus 10.. Did Ì_ leave a line in between paragraphs?
ham,"Good morning, my Love ... I go to sleep now and wish you a great day full of feeling better and opportunity ... You are my last thought babe, I LOVE YOU *kiss*"
ham,Ha... Both of us doing e same thing. But i got tv 2 watch. U can thk of where 2 go tonight or u already haf smth in mind...
ham,I dun believe u. I thk u told him.
ham,But i'm surprised she still can guess right lor...
ham,Customer place i will call you.
ham,"Sir, i am waiting for your call, once free please call me."
ham,Hey sexy buns! What of that day? No word from you this morning on YM ... :-( ... I think of you
spam,SplashMobile: Choose from 1000s of gr8 tones each wk! This is a subscrition service with weekly tones costing 300p. U have one credit - kick back and ENJOY
ham,I want to be there so i can kiss you and feel you next to me
spam,WINNER!! As a valued network customer you have been selected to receivea å£900 prize reward! To claim call 09061701461. Claim code KL341. Valid 12 hours only.
ham,Can... I'm free...
ham,I notice you like looking in the shit mirror youre turning into a right freak
ham,Where did u go? My phone is gonna die you have to stay in here
ham,Don know..he is watching film in computer..
ham,I need... Coz i never go before 
ham,"Well the weather in cali's great. But its complexities are great. You need a car to move freely, its taxes are outrageous. But all in all its a great place. The sad part is i missing home."
ham,But i haf enuff space got like 4 mb...
ham,"Hey there! Glad u r better now. I hear u treated urself to a digi cam, is it good? We r off at 9pm. Have a fab new year, c u in coupla wks!"
ham,So u wan 2 come for our dinner tonight a not?
ham,Great. So should i send you my account number.
ham,S but mostly not like that.
ham,Yo you guys ever figure out how much we need for alcohol? Jay and I are trying to figure out how much we can safely spend on weed
ham,Hello! How r u? Im bored. Inever thought id get bored with the tv but I am. Tell me something exciting has happened there? Anything! =/
ham,That's my honeymoon outfit. :)
ham,Appt is at &lt;TIME&gt; am. Not my fault u don't listen. I told u twice
ham,K.k:)apo k.good movie.
ham,Usually the body takes care of it buy making sure it doesnt progress. Can we pls continue this talk on saturday.
ham,Okay name ur price as long as its legal! Wen can I pick them up? Y u ave x ams xx
ham,LOL that would be awesome payback.
ham,We are supposed to meet to discuss abt our trip... Thought xuhui told you? In the afternoon. Thought we can go for lesson after that
ham,"She said,'' do u mind if I go into the bedroom for a minute ? '' ''OK'', I sed in a sexy mood. She came out 5 minuts latr wid a cake...n My Wife,"
spam,PRIVATE! Your 2003 Account Statement for 07808247860 shows 800 un-redeemed S. I. M. points. Call 08719899229 Identifier Code: 40411 Expires 06/11/04
ham,Msgs r not time pass.They silently say that I am thinking of U right now and also making U think of me at least 4 a moment. Gd nt.swt drms @Shesil
spam,Congrats! Nokia 3650 video camera phone is your Call 09066382422 Calls cost 150ppm Ave call 3mins vary from mobiles 16+ Close 300603 post BCM4284 Ldn WC1N3XX
spam,important information 4 orange user . today is your lucky day!2find out why log onto http://www.urawinner.com THERE'S A FANTASTIC SURPRISE AWAITING YOU!
ham,No need for the drug anymore.
ham,"Babe, I need your advice"
ham,Ok..
ham,Do you know what Mallika Sherawat did yesterday? Find out now @  &lt;URL&gt;
ham,"I got another job! The one at the hospital doing data analysis or something, starts on monday! Not sure when my thesis will got finished"
ham,"Honeybee Said: *I'm d Sweetest in d World* God Laughed &amp; Said: *Wait,U Havnt Met d Person Reading This Msg* MORAL: Even GOD Can Crack Jokes! GM+GN+GE+GN:)"
ham,"Come to me right now, Ahmad"
ham,"Hello. Sort of out in town already. That . So dont rush home, I am eating nachos. Will let you know eta."
ham,My battery is low babe
ham,What not under standing.
ham,"As in missionary hook up, doggy hook up, standing...|"
ham,Whatsup there. Dont u want to sleep
spam,"Win the newest ÛÏHarry Potter and the Order of the Phoenix (Book 5) reply HARRY, answer 5 questions - chance to be the first among readers!"
ham,Lil fever:) now fine:)
ham,"Yeah, I'll leave in a couple minutes &amp; let you know when I get to mu"
ham,Haven't heard anything and he's not answering my texts so I'm guessing he flaked. That said the jb is fantastic
ham,Honey boo I'm missing u.
ham,Who's there say hi to our drugdealer
ham,Am okay. Will soon be over. All the best
ham,K da:)how many page you want?
ham,I'm aight. Wat's happening on your side.
ham,Stupid auto correct on my phone
ham,I'm vivek:)i got call from your number.
ham,Joy's father is John. Then John is the NAME of Joy's father. Mandan
ham,"Neither [in sterm voice] - i'm studying. All fine with me! Not sure the  thing will be resolved, tho. Anyway. Have a fab hols"
ham,We're on the opposite side from where we dropped you off
ham,Hey gorgeous man. My work mobile number is. Have a good one babe. Squishy Mwahs.
ham,"Call me, i am senthil from hsbc."
ham,Joy's father is John. Then John is the ____ of Joy's father. If u ans ths you hav  &lt;#&gt;  IQ. Tis s IAS question try to answer.
spam,"0A$NETWORKS allow companies to bill for SMS, so they are responsible for their \suppliers\"""
ham,"Japanese Proverb: If one Can do it, U too Can do it, If none Can do it,U must do it Indian version: If one Can do it, LET HIM DO it.. If none Can do it,LEAVE it!! And finally Kerala version: If one can do it, Stop him doing it.. If none can do it, Make a strike against it ..."
ham,I am going to sao mu today. Will be done only at 12 
ham,Shant disturb u anymore... Jia you...
spam,You won't believe it but it's true. It's Incredible Txts! Reply G now to learn truly amazing things that will blow your mind. From O2FWD only 18p/txt
ham,Am slow in using biola's fne
ham,"K.. I yan jiu liao... Sat we can go 4 bugis vill one frm 10 to 3 den hop to parco 4 nb. Sun can go cine frm 1030 to 2, den hop to orc mrt 4 hip hop at 4..."
ham,I dunno until when... Lets go learn pilates...
ham,happened here while you were adventuring
ham,"Hello, yeah i've just got out of the bath and need to do my hair so i'll come up when i'm done, yeah?"
ham,"Oh, i will get paid. The most outstanding one is for a commercial i did for Hasbro...in AUGUST! They made us jump through so many hoops to get paid. Still not."
ham,Yes its possible but dint try. Pls dont tell to any one k
ham,Neshanth..tel me who r u?
spam,IMPORTANT MESSAGE. This is a final contact attempt. You have important messages waiting out our customer claims dept. Expires 13/4/04. Call 08717507382 NOW!
spam,Do you want a New Nokia 3510i Colour Phone Delivered Tomorrow? With 200 FREE minutes to any mobile + 100 FREE text + FREE camcorder Reply or Call 8000930705
ham,They released vday shirts and when u put it on it makes your bottom half naked instead of those white underwear.
ham,ÌÏ only send me the contents page...
ham,"Cool, text me when you're ready"
ham,Hey! Congrats 2u2. id luv 2 but ive had 2 go home!
ham,How u doin baby girl ?? hope u are okay every time I call ure phone is off! I miss u get in touch
ham,Ok anyway no need to change with what you said
spam,"Twinks, bears, scallies, skins and jocks are calling now. Don't miss the weekend's fun. Call 08712466669 at 10p/min. 2 stop texts call 08712460324(nat rate)"
spam,Someone has conacted our dating service and entered your phone because they fancy you!To find out who it is call from landline 09111030116. PoBox12n146tf15
ham,"Watching cartoon, listening music &amp; at eve had to go temple &amp; church.. What about u?"
ham,Good morning princess! Have a great day!
ham,How come i din c Ì_... Yup i cut my hair...
ham,He's just gonna worry for nothing. And he won't give you money its no use.
ham,:-) :-)
ham,What makes you most happy?
ham,"That's what I love to hear :V see you sundayish, then"
ham,Then dun wear jeans lor...
ham,"Nope, I'm still in the market"
ham,Did you show him and wot did he say or could u not c him 4 dust?
ham,I asked sen to come chennai and search for job.
ham,"Sorry pa, i dont knw who ru pa?"
ham,"I'm in a meeting, call me later at"
spam,Guess what! Somebody you know secretly fancies you! Wanna find out who it is? Give us a call on 09065394514 From Landline DATEBox1282EssexCM61XN 150p/min 18
ham,Watching ajith film ah?
ham,"Good evening Sir, hope you are having a nice day. I wanted to bring it to your notice that I have been late in paying rent for the past few months and have had to pay a $ &lt;#&gt;  charge. I felt it would be inconsiderate of me to nag about something you give at great cost to yourself and that's why i didnt speak up. I however am in a recession and wont be able to pay the charge this month hence my askin well ahead of month's end. Can you please help. Thank you for everything."
ham,I got it before the new year cos yetunde said she wanted to surprise you with it but when i didnt see money i returned it mid january before the  &lt;#&gt; day return period ended.
ham,Well. Im computerless. Time to make some oreo truffles
ham,You please give us connection today itself before  &lt;DECIMAL&gt;  or refund the bill
ham,Where are you lover ? I need you ...
ham,I walked an hour 2 c u! doesnåÕt that show I care y wont u believe im serious?
ham,Hey you gave them your photo when you registered for driving ah? Tmr wanna meet at yck? 
ham,Lemme know when you're here
ham,I am in office:)whats the matter..msg me now.i will call you at break:).
ham,Yup song bro. No creative. Neva test quality. He said check review online.
spam,2/2 146tf150p
ham,I fetch yun or u fetch?
ham,No. On the way home. So if not for the long dry spell the season would have been over
ham,"Uh, heads up we don't have THAT much left"
ham,Ok that's great thanx a lot.
spam,WIN a å£200 Shopping spree every WEEK Starting NOW. 2 play text STORE to 88039. SkilGme. TsCs08714740323 1Winawk! age16 å£1.50perweeksub.
ham,Ok . . now i am in bus. . If i come soon i will come otherwise tomorrow
ham,What pa tell me.. I went to bath:-)
ham,I'm done. C Ì_ there.
ham,Its sunny in california. The weather's just cool
ham,"Gud gud..k, chikku tke care.. sleep well gud nyt"
ham,"And how you will do that, princess? :)"
ham,Ok lor. Anyway i thk we cant get tickets now cos like quite late already. U wan 2 go look 4 ur frens a not? Darren is wif them now...
ham,I am not sure about night menu. . . I know only about noon menu
ham,Do u konw waht is rael FRIENDSHIP Im gving yuo an exmpel: Jsut ese tihs msg.. Evrey splleing of tihs msg is wrnog.. Bt sitll yuo can raed it wihtuot ayn mitsake.. GOODNIGHT &amp; HAVE A NICE SLEEP..SWEET DREAMS..
ham,Û_ and donÛ÷t worry weÛ÷ll have finished by march Û_ ish!
ham,There are many company. Tell me the language.
ham,Will it help if we propose going back again tomorrow
ham,I'm serious. You are in the money base
ham,"Nope. Since ayo travelled, he has forgotten his guy"
ham,K..give back my thanks.
spam,Send a logo 2 ur lover - 2 names joined by a heart. Txt LOVE NAME1 NAME2 MOBNO eg LOVE ADAM EVE 07123456789 to 87077 Yahoo! POBox36504W45WQ TxtNO 4 no ads 150p.
ham,Ok i wont call or disturb any one. I know all are avoiding me. I am a burden for all
ham,Hey so whats the plan this sat? 
ham,In other news after hassling me to get him weed for a week andres has no money. HAUGHAIGHGTUJHYGUJ
spam,We tried to call you re your reply to our sms for a video mobile 750 mins UNLIMITED TEXT + free camcorder Reply of call 08000930705 Now
ham,"That's fine, I'll bitch at you about it later then"
ham,"Honey ? Sweetheart ? Darling ? Sexy buns ? Sugar plum ? Loverboy ? I miss you, boytoy ... *smacks your ass* Did you go to the gym too ?"
ham,"Depends on quality. If you want the type i sent boye, faded glory, then about 6. If you want ralphs maybe 2"
ham,Get ready for  &lt;#&gt;  inches of pleasure...
spam,Do you want 750 anytime any network mins 150 text and a NEW VIDEO phone for only five pounds per week call 08002888812 or reply for delivery tomorrow
ham,Is that what time you want me to come?
ham,Hi babe its me thanks for coming even though it didnt go that well!i just wanted my bed! Hope to see you soon love and kisses xxx
ham,No problem with the renewal. I.ll do it right away but i dont know his details.
ham,Neva mind it's ok..
ham,Have a great trip to India. And bring the light to everyone not just with the project but with everyone that is lucky to see you smile. Bye. Abiola
ham,"Wow. I never realized that you were so embarassed by your accomodations. I thought you liked it, since i was doing the best i could and you always seemed so happy about \the cave\"". I'm sorry I didn't and don't have more to give. I'm sorry i offered. I'm sorry your room was so embarassing."""
ham,No message..no responce..what happend?
ham,Better. Made up for Friday and stuffed myself like a pig yesterday. Now I feel bleh. But at least its not writhing pain kind of bleh.
spam,"BangBabes Ur order is on the way. U SHOULD receive a Service Msg 2 download UR content. If U do not, GoTo wap. bangb. tv on UR mobile internet/service menu"
ham,Do Ì_ noe if ben is going?
ham,Thanx 4 e brownie it's v nice...
ham,"Goodmorning, today i am late for 1hr."
ham,Not planned yet :)going to join company on jan 5 only.don know what will happen after that.
ham,"Sorry vikky, i'm Watching olave mandara movie kano in trishul theatre wit my frnds.."
ham,They said Ì_ dun haf passport or smth like dat.. Or Ì_ juz send to my email account..  
ham,How to Make a girl Happy? It's not at all difficult to make girls happy. U only need to be... 1. A friend 2. Companion 3. Lover 4. Chef . . .  &lt;#&gt; . Good listener  &lt;#&gt; . Organizer  &lt;#&gt; . Good boyfriend  &lt;#&gt; . Very clean  &lt;#&gt; . Sympathetic  &lt;#&gt; . Athletic  &lt;#&gt; . Warm . . .  &lt;#&gt; . Courageous  &lt;#&gt; . Determined  &lt;#&gt; . True  &lt;#&gt; . Dependable  &lt;#&gt; . Intelligent . . .  &lt;#&gt; . Psychologist  &lt;#&gt; . Pest exterminator  &lt;#&gt; . Psychiatrist  &lt;#&gt; . Healer . .  &lt;#&gt; . Stylist  &lt;#&gt; . Driver . . Aaniye pudunga venaam..
ham,Mum say we wan to go then go... Then she can shun bian watch da glass exhibition... 
ham,He remains a bro amongst bros
ham,Some of them told accenture is not confirm. Is it true.
ham,Dude avatar 3d was imp. At one point i thought there were actually flies in the room and almost tried hittng one as a reflex
ham,Yes. that will be fine. Love you. Be safe.
spam,"URGENT! Your mobile No 077xxx WON a å£2,000 Bonus Caller Prize on 02/06/03! This is the 2nd attempt to reach YOU! Call 09066362206 ASAP! BOX97N7QP, 150ppm"
ham,Thats cool. How was your day?
ham,Can you do a mag meeting this avo at some point?
ham,Hey come online! Use msn... We are all there
spam,"Hi babe its Chloe, how r u? I was smashed on saturday night, it was great! How was your weekend? U been missing me? SP visionsms.com Text stop to stop 150p/text"
spam,"Double mins and txts 4 6months FREE Bluetooth on Orange. Available on Sony, Nokia Motorola phones. Call MobileUpd8 on 08000839402 or call2optout/N9DX"
ham,Not a lot has happened here. Feels very quiet. Beth is at her aunts and charlie is working lots. Just me and helen in at the mo. How have you been? 
spam,I'd like to tell you my deepest darkest fantasies. Call me 09094646631 just 60p/min. To stop texts call 08712460324 (nat rate)
ham,MMM ... Fuck .... Merry Christmas to me
ham,U sick still can go shopping?
ham,Ok...
ham,Fwiw the reason I'm only around when it's time to smoke is that because of gas I can only afford to be around when someone tells me to be and that apparently only happens when somebody wants to light up
ham,Wat uniform? In where get?
ham,"7 wonders in My WORLD 7th You 6th Ur style 5th Ur smile 4th Ur Personality 3rd Ur Nature 2nd Ur SMS and 1st \Ur Lovely Friendship\""... good morning dear"""
ham,Good Morning plz call me sir
ham,Mmmm ... Fuck ... Not fair ! You know my weaknesses ! *grins* *pushes you to your knee's* *exposes my belly and pulls your head to it* Don't forget ... I know yours too *wicked smile*
ham,When i have stuff to sell i.ll tell you
ham,"Sir, good morning. Hope you had a good weekend. I called to let you know that i was able to raise  &lt;#&gt;  from my dad. He however said he would make the rest available by mid feb. This amount is still quite short and i was hoping you would help. Do have a good day. Abiola"
ham,I will reach office around  &lt;DECIMAL&gt; . &amp; my mobile have problem. You cann't get my voice. So call you asa i'll free
ham,Well at this right I'm gonna have to get up and check today's steam sales/pee so text me when you want me to come get you
spam,"SIX chances to win CASH! From 100 to 20,000 pounds txt> CSH11 and send to 87575. Cost 150p/day, 6days, 16+ TsandCs apply Reply HL 4 info"
ham,When you came to hostel.
ham,"Hi Shanil,Rakhesh here.thanks,i have exchanged the uncut diamond stuff.leaving back. Excellent service by Dino and Prem."
ham,Ok going to sleep. Hope i can meet her.
ham,HI DARLIN IVE JUST GOT BACK AND I HAD A REALLY NICE NIGHT AND THANKS SO MUCH FOR THE LIFT SEE U TOMORROW XXX
spam,A å£400 XMAS REWARD IS WAITING FOR YOU! Our computer has randomly picked you from our loyal mobile customers to receive a å£400 reward. Just call 09066380611
ham,"Dad wanted to talk about the apartment so I got a late start, omw now"
ham,:-( sad puppy noise
ham,Can you open the door?
ham,"Yun ah.the ubi one say if Ì_ wan call by tomorrow.call 67441233 look for irene.ere only got bus8,22,65,61,66,382. Ubi cres,ubi tech park.6ph for 1st 5wkg days.Ì¬n"
ham,An excellent thought by a misundrstud frnd: I knw u hate me bt the day wen u'll knw the truth u'll hate urself:-( Gn:-)
